<?xml version="1.0" encoding="UTF-8"?>
<!ELEMENT users (user)+>
<!ELEMENT user (forename?, surname?, email)>
<!ELEMENT forename (#PCDATA)>
<!ELEMENT surname (#PCDATA)>
<!ELEMENT email (#PCDATA)>